{
  "$schema": "./keyword-library.schema.json",
  "version": 1,
  "updatedAt": "2026-03-23T07:40:09.615Z",
  "notes": "Simplified to 6 categories: strategy, coding, vision, support, general, chat. strategy merges planning + advanced_coding; support merges daily_support + emergency_fallback; quick_response keywords were fully preserved by merging into support/general/chat.\n[scheme B] move ambiguous short tokens (pip/CI/pipeline) out of contains sets; reintroduce via regex word-boundary/context patterns.\n[sync] merged coding keyword draft (coding关键词库.txt part1/2/3/4) keywordSets into keyword-library.json (sets only; not auto-wired).\n[cleanup] remove ambiguous tokens CI/pipeline from coding.feature.build_and_toolchain (handled by regex/safer phrases).\n[wiring] add coding.feature.package_files and coding.feature.build_and_toolchain to kinds.coding positive (weight=2).\n[fix] normalize regex pattern escape level (\\\\ -> \\) so RegExp() receives real regex escapes.\n[tune] set coding.minStrongHits=0 to improve recall for file/tooling signals.\n[tune] restore coding.minStrongHits=1 (use *.strong set ids to satisfy strongHit without raising weight).\n[tune] mark package_files/build_and_toolchain as strong by using *.strong set ids (counts as strongHit).\n[conservative] add small safe strong coding set for framework/tooling-specific terms (weight=2).\n[strategy scheme B] move race/architecture to regex word-boundary to avoid substring matches (trace/conceptual steals).\n[conservative] add context.Context/trace id (Go tracing) to safe coding strong set.\n[sql] wire coding.lang.sql.strong (weight=2) so natural-language prompts that mention 'SQL' (without SELECT/FROM) still hit coding under minStrongHits=1.\n[cleanup] dedup coding.lang.sql.strong terms to avoid double scoring (SQL vs SQL：).\n[sql] simplify coding.lang.sql.strong: keep only core tokens to avoid duplicate matches (SQL:, SQL：).\n[auto-hardening] trial enable: coding.feature.build_and_toolchain.strong, coding.feature.c_cpp.strong\n[auto-hardening] trial enable: coding.feature.csharp_dotnet.strong, coding.feature.error_codes.strong\n[auto-hardening] trial enable: coding.feature.java_jvm.strong, coding.feature.js_ts_node.strong\n[auto-hardening] trial enable: coding.feature.kotlin.strong, coding.feature.package_files.strong\n[auto-hardening] trial enable: coding.feature.php.strong, coding.feature.powershell.strong\n[auto-hardening] trial enable: coding.feature.python.strong, coding.feature.risky_or_generic_reference_only.strong\n[auto-hardening] trial enable: coding.feature.shell.strong, coding.feature.solidity.strong\n[auto-hardening] trial enable: coding.feature.sql.strong, coding.feature.swift_objc.strong\n[auto-hardening] trial enable: coding.lang.abbrev.safe.strong, coding.lang.dsl_and_data.strong\n[auto-hardening] trial enable: coding.scenario.c_cpp.strong, coding.scenario.c_cpp_tooling_modern.strong\n[auto-hardening] trial enable: coding.scenario.common.db.strong, coding.scenario.common.devops.strong\n[auto-hardening] trial enable: coding.scenario.csharp_dotnet.strong, coding.scenario.dart_flutter.strong\n[auto-hardening] trial enable: coding.scenario.dotnet_ecosystem.strong, coding.scenario.erlang_elixir.strong\n[auto-hardening] trial enable: coding.scenario.go.strong, coding.scenario.go_ecosystem.strong\n[auto-hardening] trial enable: coding.scenario.haskell.strong, coding.scenario.hdl.strong\n[auto-hardening] trial enable: coding.scenario.java_jvm.strong, coding.scenario.java_wrappers.strong\n[auto-hardening] trial enable: coding.scenario.js_lint_format_modern.strong, coding.scenario.js_monorepo_tooling.strong\n[auto-hardening] trial enable: coding.scenario.kotlin_android.strong, coding.scenario.matlab_r.strong\n[auto-hardening] trial enable: coding.scenario.php.strong, coding.scenario.powershell.strong\n[auto-hardening] trial enable: coding.scenario.python.strong, coding.scenario.python_tooling_modern.strong\n[auto-hardening] trial enable: coding.scenario.rust_ecosystem.strong, coding.scenario.scala.strong\n[auto-hardening] trial enable: coding.scenario.shell.strong, coding.scenario.solidity.strong\n[auto-hardening] trial enable: coding.scenario.sql.strong, coding.scenario.swift_ios.strong\n[auto-hardening] trial enable: coding.feature.kotlin.strong, coding.feature.package_files.strong\n[auto-hardening] trial enable: coding.feature.php.strong, coding.feature.powershell.strong\n[auto-hardening] trial enable: coding.feature.python.strong, coding.feature.risky_or_generic_reference_only.strong\n[auto-hardening] trial enable: coding.feature.shell.strong, coding.feature.solidity.strong\n[auto-hardening] trial enable: coding.feature.sql.strong, coding.feature.swift_objc.strong\n[auto-hardening] trial enable: coding.lang.abbrev.safe.strong, coding.lang.dsl_and_data.strong\n[auto-hardening] trial enable: coding.scenario.c_cpp.strong, coding.scenario.c_cpp_tooling_modern.strong\n[auto-hardening] trial enable: coding.scenario.common.db.strong, coding.scenario.common.devops.strong\n[auto-hardening] trial enable: coding.scenario.csharp_dotnet.strong, coding.scenario.dart_flutter.strong\n[auto-hardening] trial enable: coding.scenario.dotnet_ecosystem.strong, coding.scenario.erlang_elixir.strong\n[auto-hardening] trial enable: coding.scenario.go.strong, coding.scenario.go_ecosystem.strong\n[auto-hardening] trial enable: coding.scenario.haskell.strong, coding.scenario.hdl.strong\n[auto-hardening] trial enable: coding.scenario.java_jvm.strong, coding.scenario.java_wrappers.strong\n[auto-hardening] trial enable: coding.scenario.js_lint_format_modern.strong, coding.scenario.js_monorepo_tooling.strong\n[auto-hardening] trial enable: coding.scenario.kotlin_android.strong, coding.scenario.matlab_r.strong\n[auto-hardening] trial enable: coding.scenario.php.strong, coding.scenario.powershell.strong\n[auto-hardening] trial enable: coding.scenario.python.strong, coding.scenario.python_tooling_modern.strong\n[auto-hardening] trial enable: coding.scenario.rust_ecosystem.strong, coding.scenario.scala.strong\n[auto-hardening] trial enable: coding.scenario.shell.strong, coding.scenario.solidity.strong\n[auto-hardening] trial enable: coding.scenario.sql.strong, coding.scenario.swift_ios.strong\n[regex-bounds] add contextful word-boundary regex for language mentions, rails/bun commands, verilog reg, and filename extensions.\n[fix] correct regex escape level for contextful word-boundary patterns.\n[fix] remove overly broad filename/file-ext regex (docs.rs false positive).\n[fix] split Python/Rust regex into CN/EN variants (JS \\b does not work after CJK tokens).\n[route-fix] TypeScript, debounce, remove:support.weak:支持\n[fix] promote TypeScript/debounce to coding.strong (contains) and drop their regex; keep support.weak without ambiguous token 支持.\n[wiring] wire ALL coding.* keywordSets into kinds.coding positive (weight=3).\n[wiring] exclude coding.abbrev.risky_reference_only from positive wiring (reference-only).\n[tighten] keep ALL coding.* sets wired, but down-weight non-strong sets to 1; keep *.strong and coding.strong at 3. Exclude coding.abbrev.risky_reference_only from positive.\n[tune] add optimization-related strong phrases (code/perf/sql/query/index) to coding.strong; keep bare 优化 in coding.weak only.\n[tune] add optimization/improvement suggestion phrases to support.strong and wire into support positive.",
  "defaultFallbackKind": "chat",
  "normalization": {
    "lowercase": true,
    "trim": true,
    "collapseWhitespace": true
  },
  "keywordSets": {
    "coding.strong": [
      "debug",
      "traceback",
      "stack trace",
      "exception",
      "crash",
      "fatal error",
      "报错",
      "TypeError",
      "ReferenceError",
      "SyntaxError",
      "ModuleNotFoundError",
      "ECONNREFUSED",
      "ETIMEDOUT",
      "build failed",
      "tsc",
      "lint",
      "typecheck",
      "npm",
      "pnpm",
      "poetry",
      "conda",
      "```",
      ".ts",
      ".js",
      ".py",
      "debugging",
      "error",
      "bug",
      "AssertionError",
      "ImportError",
      "EADDRINUSE",
      "pip install",
      "pip3 install",
      "CI/CD",
      "GitHub Actions",
      "TypeScript",
      "debounce",
      "代码优化",
      "优化代码",
      "性能优化",
      "优化性能",
      "performance optimization",
      "optimize performance",
      "SQL优化",
      "SQL 优化",
      "优化SQL",
      "优化 SQL",
      "查询优化",
      "优化查询",
      "query optimization",
      "optimize query",
      "索引优化",
      "优化索引",
      "index optimization",
      "optimize index",
      "算法优化",
      "优化算法",
      "复杂度优化",
      "优化复杂度",
      "内存优化",
      "优化内存",
      "memory optimization",
      "optimize memory",
      "延迟优化",
      "优化延迟",
      "latency optimization",
      "optimize latency",
      "吞吐优化",
      "优化吞吐",
      "throughput optimization",
      "optimize throughput"
    ],
    "coding.weak": [
      "编程",
      "programming",
      "代码",
      "code",
      "调试",
      "debug",
      "debugging",
      "排障",
      "troubleshoot",
      "报错",
      "错误",
      "error",
      "bug",
      "异常",
      "exception",
      "崩溃",
      "crash",
      "fatal error",
      "traceback",
      "stack trace",
      "stacktrace",
      "stderr",
      "stdout",
      "log",
      "logs",
      "日志",
      "复现",
      "repro",
      "reproduce",
      "最小复现",
      "minimal repro",
      "timeout",
      "timed out",
      "ETIMEDOUT",
      "ECONNREFUSED",
      "ECONNRESET",
      "ENOTFOUND",
      "EADDRINUSE",
      "EACCES",
      "permission denied",
      "401",
      "403",
      "404",
      "429",
      "500",
      "502",
      "503",
      "TypeError",
      "ReferenceError",
      "SyntaxError",
      "AssertionError",
      "NullPointerException",
      "NPE",
      "NullReference",
      "KeyError",
      "IndexError",
      "ValueError",
      "ImportError",
      "ModuleNotFoundError",
      "ModuleNotFound",
      "NoSuchMethod",